<?xml version="1.0" encoding="UTF-8"?>
<!-- edited with XMLSpy v2008 rel. 2 (http://www.altova.com) by mazuki (darksiderg) -->
<!--W3C Schema generated by XMLSpy v2008 rel. 2 (http://www.altova.com)-->
<xs:schema xmlns:xs="http://www.w3.org/2001/XMLSchema">
	<xs:element name="abs-customers">
		<xs:complexType>
			<xs:sequence>
				<xs:element ref="abs-customer" maxOccurs="unbounded"/>
			</xs:sequence>
		</xs:complexType>
	</xs:element>
	<xs:element name="abs-customer">
		<xs:complexType>
			<xs:sequence>
				<xs:element ref="abs-balance"/>
			</xs:sequence>
			<xs:attribute name="name" type="xs:string" use="required"/>
		</xs:complexType>
	</xs:element>
	<xs:element name="abs-total-yaz-time" type="xs:int"/>
	<xs:element name="abs-pays-every-yaz" type="xs:int"/>
	<xs:element name="abs-owner" type="xs:string"/>
	<xs:element name="abs-loans">
		<xs:complexType>
			<xs:sequence>
				<xs:element ref="abs-loan" maxOccurs="unbounded"/>
			</xs:sequence>
		</xs:complexType>
	</xs:element>
	<xs:element name="abs-loan">
		<xs:complexType>
			<xs:sequence>
				<xs:element ref="abs-owner"/>
				<xs:element ref="abs-category"/>
				<xs:element ref="abs-capital"/>
				<xs:element ref="abs-total-yaz-time"/>
				<xs:element ref="abs-pays-every-yaz"/>
				<xs:element ref="abs-intrist-per-payment"/>
			</xs:sequence>
			<xs:attribute name="id" type="xs:string" use="required"/>
		</xs:complexType>
	</xs:element>
	<xs:element name="abs-intrist-per-payment" type="xs:int"/>
	<xs:element name="abs-descriptor">
		<xs:complexType>
			<xs:sequence>
				<xs:element ref="abs-categories"/>
				<xs:element ref="abs-loans"/>
				<xs:element ref="abs-customers"/>
			</xs:sequence>
		</xs:complexType>
	</xs:element>
	<xs:element name="abs-category" type="xs:string"/>
	<xs:element name="abs-categories">
		<xs:complexType>
			<xs:sequence>
				<xs:element ref="abs-category" maxOccurs="unbounded"/>
			</xs:sequence>
		</xs:complexType>
	</xs:element>
	<xs:element name="abs-capital" type="xs:int"/>
	<xs:element name="abs-balance" type="xs:int"/>
</xs:schema>
