<abs-descriptor xmlns:xsi="http://www.w3.org/2001/XMLSchema-instance" xsi:noNamespaceSchemaLocation="ABS-V1.xsd">
	<abs-categories>
		<abs-category>Setup a business</abs-category>
		<abs-category>Overdraft cover</abs-category>
		<abs-category>Investment</abs-category>
		<abs-category>Happy Event</abs-category>
		<abs-category>Renovate</abs-category>
	</abs-categories>
	<abs-loans>
		<abs-loan id="stock market introduction">
			<abs-owner>Menash</abs-owner>
			<abs-category>Investment</abs-category>
			<abs-capital>2400</abs-capital>
			<abs-total-yaz-time>12</abs-total-yaz-time>
			<abs-pays-every-yaz>1</abs-pays-every-yaz>
			<abs-intrist-per-payment>5</abs-intrist-per-payment>
		</abs-loan>
		<abs-loan id="build a room">
			<abs-owner>Avrum</abs-owner>
			<abs-category>Renovate</abs-category>
			<abs-capital>3000</abs-capital>
			<abs-total-yaz-time>10</abs-total-yaz-time>
			<abs-pays-every-yaz>2</abs-pays-every-yaz>
			<abs-intrist-per-payment>3</abs-intrist-per-payment>
		</abs-loan>
		<abs-loan id="Bar Mitzva !">
			<abs-owner>Mosh</abs-owner>
			<abs-category>Happy Event</abs-category>
			<abs-capital>2500</abs-capital>
			<abs-total-yaz-time>25</abs-total-yaz-time>
			<abs-pays-every-yaz>5</abs-pays-every-yaz>
			<abs-intrist-per-payment>15</abs-intrist-per-payment>
		</abs-loan>
		<abs-loan id="Wedding">
			<abs-owner>Levana</abs-owner>
			<abs-category>Happy Event</abs-category>
			<abs-capital>24000</abs-capital>
			<abs-total-yaz-time>24</abs-total-yaz-time>
			<abs-pays-every-yaz>2</abs-pays-every-yaz>
			<abs-intrist-per-payment>5</abs-intrist-per-payment>
		</abs-loan>
		<abs-loan id="I don't have money">
			<abs-owner>Tikva</abs-owner>
			<abs-category>Overdraft cover</abs-category>
			<abs-capital>4000</abs-capital>
			<abs-total-yaz-time>10</abs-total-yaz-time>
			<abs-pays-every-yaz>1</abs-pays-every-yaz>
			<abs-intrist-per-payment>3</abs-intrist-per-payment>
		</abs-loan>
		<abs-loan id="Damn the banks">
			<abs-owner>Menash</abs-owner>
			<abs-category>Setup a business</abs-category>
			<abs-capital>42000</abs-capital>
			<abs-total-yaz-time>21</abs-total-yaz-time>
			<abs-pays-every-yaz>7</abs-pays-every-yaz>
			<abs-intrist-per-payment>20</abs-intrist-per-payment>
		</abs-loan>				
	</abs-loans>
	<abs-customers>
		<abs-customer name="Menash">
			<abs-balance>5000</abs-balance>
		</abs-customer>
		<abs-customer name="Avrum">
			<abs-balance>1000</abs-balance>
		</abs-customer>
		<abs-customer name="Tikva">
			<abs-balance>10000</abs-balance>
		</abs-customer>
		<abs-customer name="Shosh">
			<abs-balance>20000</abs-balance>
		</abs-customer>
		<abs-customer name="Mosh">
			<abs-balance>15000</abs-balance>
		</abs-customer>
		<abs-customer name="Bina">
			<abs-balance>2000</abs-balance>
		</abs-customer>
		<abs-customer name="Levana">
			<abs-balance>100</abs-balance>
		</abs-customer>
	</abs-customers>
</abs-descriptor>
